"My dad still critiques and gets mad at my brothers at bats. Like chill fam, I think he’ll be okay  #AlwaysCoaching"
Why y’all so mad enjoy life
Mad it’s not on firestick yet 
mad asf #superfly not on firestick yet 
"""Im mad at you and not talking to you""  okay 5 year old"
life can be so good I’m done being mad all the time
really just broke two nails you know I’m mad
Last night was funpic.twitter.com/Ugsd0GlYQ3
"I wish I can record these kids, they mad adorable"
"My whole Twitter is wanted food elements, being mad at other people, and being mad at myself lmao"
People be mad when you want to grow and not stay broke with them.
Ya be mad and don’t even know why ya mad grate
that shit be mad annoying  like nigga we don’t even know eachother like that & you talking about you coming to pick me up you wanna chill  https://twitter.com/kelseeynicoleee/status/1011716123954311168 …
Niggas get yo # and do this shit pic.twitter.com/1yw0FkEcA8
Yall dont wanna know how long it took me to get my record player working cause a piece was out of place and I was so mad
"July 2, 9am - The only rally that matters if you're mad/sad/frustrated about this country's immigration policies. #AbolishICE #FreeOurFutures #Hartford #ImmigrantLed Can we count you in? Our demands here: http://bit.ly/CalltoActionCT pic.twitter.com/lzlRq0PJcL"
Mad Max is probably one of the leader's of Jarrett's/Obama's shadow government--the seditious/treasonous 30K army called Organizing For America to destabilize USA and overthrow the constitutional republic.
"boy if i treated people the way they treated me, they’d be so mad"
Is it petty that I’m mad someone got the exact same tattoo as me a week later or nah?
There’s consequences to entering a country illegally and a person shouldn’t be mad when they have to face the consequences when caught
Bottle girls making minimum wage and  are thirsty for tips so I get why their mad. But YOU know what u signed up for now run and grab me a Corona. Don’t forget my lime
Last night was mad ill Shoutout @lloydbanks we showed love and he showed it right back dapped us… https://www.instagram.com/p/BdqIooPlKNu/ 
7 years ago today this picture was taken. The school was mad lmao. What are you being for… https://www.instagram.com/p/Ba7L1WolEzA/ 
Mad proud of one of my ESPN mentees who's joining the #Turner Broadcasting Family in #Atlanta… https://www.instagram.com/p/BYM1bZZhPRj/ 
BUT A WAH THIS??? THIS MAD BWOY 'YANKEE TAIL' This is my little brother. A day after his… https://www.instagram.com/p/BS9Q6x6DfkE/ 
This week is going to be mad rough 
I get so mad at the end of every episode of @finding_carter cause I now have to wait a week to watch it again 
Don't get mad when I put you in ya place
Diary of mad black zombie killer  #TheWalkingDead #DeadBuzz
YO RiFF RAFF WHEN YOURE iN CONNECTiCUT YOU BEST COME CHECK OUT THE WRESTLiNG RiNG CUZ YOURE MAD DECENT DM US OR SOME SHiT @JODYHiGHROLLER
Duke fans mad as fuck 
friendly reminder not to reject and forget your faith when you're mad at someone so u can dwell on your anger bc it only makes things worse
"Mad fire trucks at Sheehan, did you drop a demo? @CalRhodes10"
"meeting girls dads is awesome... like hey im gonna fuk ur daughter
u mad"
Still mad I never went to ihop today
Bae always gunna be bae so stay mad bitches
@thereallisaann LMAO you should grab a Rap name too Mad Money Murf
"I don't even get mad at shit anymore, it's just like, oh ok that's cool I guess"
@MadDogRadio @GlennDOrdway @jamiedukes Big O & Jamie Dukes killing it on Mad Dog!
I have the SMARTEST mouth when I'm mad 
Smh people are addicted to drugs and my mom gets mad that I eat too many granola bars
HOW YALL BITCHES MAD CUS YALL THOTS? YALL BE TRYNA KIDNAP NIGGAS FROM THEY GIRLS?
You mad bro? @RSherman_25 #PatsNation
When bae is mad at you and doesn't let you hit pic.twitter.com/lAALAZH7EC
Seattle mad 
“@seancoachevers: @kevconnorsespn talk crap when you're team actually makes the playoffs #DeflateThis” you mad bro?
"When a guy starts kissing on your neck and stuff do other females think, ""damn he's going to be mad af when he taste my perfume/lotion"" "
I wanna throw hands wit someone... I'm not even mad I just wanna fight that's all
"Senior proms gonna be mad fun this year, can't wait"
when u doing good sometimes that really makes people mad lol I will never understand cause I'm always the first to salute niggas doing good
"“People leave you out in the cold and get mad when you learn how to get warm by yourself."""
Why did we do this we are gonna get mad notifications now pic.twitter.com/9sVRid3UGo
it's supposed to be mad snowy and zito knows it too
Deidre won the 1000 ticket jackpot and I didn't and I'm so mad ):
It actually makes me so mad that one persons mistake is used to the advantage for another person to tweet about just to get favorites
Party was a success it was mad love in the building deff was the best birthday ever 
Lawrence Thomas came through the line like a mad man #CottonBowl
Lmfaooo all this Subbin started off a Picture?Like tf My Primaaa Cute are ya mad?Like ByeLet her liveya cute too
"Whenever I'm mad I cry, not cause im hurt im just so mad lmao"
“@ISmashedYoGurl: This dyke tried to fight me cuz I asked her if she gets mad when she get wet instead of hard ”  oh shit!
Lol seniors are mad affffff
"“@SexualGif: bae: ""are you mad?""
me:""no I'm fine""
bae: ""ok""
me: ""I just think it's funny that...""”            yupppp"
"Actually used in a sentence by the people walking in front me: ""bouta tap mad hoes"".  dressed as napoleon dynamite you're not."
"MHS should have a roast team, we would bring in mad banners"
IF YOURE MAD TELL ME WHY YOURE MAD IM NOT A DAMN MIND READER
Nothing makes me more mad than being blown off
Ms. Mariam was mad af  od funny 
"My dad got mad because when he asked what's wrong i responded, ""Im just a kid and life is a nightmare"""
Mad late but still got it pic.twitter.com/ujIgWFsPQt
"""@YousefAlawi: Ik that nicki is mad at us 

@NICKIMINAJ #EMABiggesFansNickiMinaj pic.twitter.com/NarPvXljV6"""
"""@SGriff2013: “@DearDiary___: Mad love RT Love. pic.twitter.com/0gZUKF5E3Z” unconditional love lol"" that's how y'all suppose to do it !"
"""@LightBright_XO: “@BestVinesEver: Is you mad or nah?  https://vine.co/v/MKTVQmF5DmQ ”"""
I hate getting mad because it turns me into a person i hate.
Just saw a bitch fall down the stairs and it mad my fucking day
I'm actually so mad that my brother broke my laptop and his bum ass can't pay me back
Another $10 open bar & I'm not mad about it..
@TheRealDisco @TheEdFerrara @MLW I'm mad. You mad? I'm mad. Damn computer gimmick. That Mr. Mad vs. Mr. Nice Guy -- #helluvadeal brother.
Ask me before you get mad over something that isn't true
don't be mad because I'm doing me better than you're doing you
My February self would be so mad at my current self for thinking 50 is cold. Sorry @bobmaxon! #brr
I wouldn't even be mad at the bitch he was fucking with bc YOUR man should have enough respect for you to not fuck with someone else.
@murda_von_ @PoosDaGawd_ nobody sad nor mad over y'all little relationship 
@katiewicander when your friend gets mad at you for posting a bad pic of her  but uses it the next day in a new tweet pic.twitter.com/PcBNWRfOX9
I like random texts ..they mad cute
oomf is mad ignorant
You ever miss someone so much you start getting mad? Lol
DON'T BE MAD CAUSE I'M DOING ME BETTER THAN YOU DOING YOUUU
All Skinny Bitches Mad At The Anaconda Song 
school hasn't even started and I'm already mad at the school
But why Cory though ? Who could be so mad at him to do this.?
The mad hatters @JeffStoecker @JoeDSports @NBCConnecticut pic.twitter.com/2ox3GplIDr
Niggas will let you go n get mad when you disappear
@Devonator69 @iLikeVinesDaily @Niikkoolaaa LMFAO ITS MAD FUNNY CUZ ITS TRUE
mad kids wearing ponchos tonight
Just put mad money away so I can buy @LeahKennedy19 @SarahLambertus and @zoeengle pizza whenever they want 
When customers whisper what they want and get mad when I ask them what they said like 3 times....#speakup
The love for this seasoning is real. #OldBay. Only #Marylanders would really understand. I'm mad I… http://instagram.com/p/rApkC9Rmik/ 
U wanna distance ur self???? Cool. I'll fall back. But when u come back trying to have what we used to have don't be mad when im not around
Everyone go follow @FreeTopher he's mad funny and his tweets be on point
"4 yr old girl I'm watching in daycare: when daddy gets really mad he says something bad
me: what does he say?
4 yr old: ..shut the fuck up"
Females don't understand how funny they are when their mad lol
When I'm mad I get reallyyyy quiet
“@ZaeWoods20: I'm filled with mad greed and a heart that doesn't bleed ” now that's weird guys @WorkThatMilly @xohmyla
Just got rlly mad bc no one was moving at the green light and then I realized I stopped behind a line of parked cars :)
"I get mad and upset too easy. Starting today I'm so over it, fuck stressing"
You get mad at the dumbest things I swear
Pharrel fashion out the box. But it's just mad wavy. The way he puts it together
Mad artsy pic.twitter.com/vBupCp9Z1N
Can't tell if I'm mad the lady put whipped cream on my drink or happy she gave me a large when I played for a small.
I can't ever stay mad at someone
When your boyfriend is mad at you pic.twitter.com/3OjTEUo2WZ
I just saw a guy get a milkshake thrown at him inside his car he looked mad tight
"People that ""don't drink sink water""
make me mad"
Dr leaves august 11th now not October 20th (Caruso's gonna be mad AF)
when you mad at bae but she trying to be all cuddly and shit... pic.twitter.com/KPKsI7fUff
MAD respect to anyone who's ever aced the physics final
We Always Got Dat Look We Not Mad Doe Happy Fathers Day To Me. pic.twitter.com/Nae5Jf9qcv
“@inyaocean: I'm really shorty-less lol ” mad bluffa 
You will never find me at another country concert. Buncha hick fucks talkin mad shit #handsfucked
"""@thefemaleboook: When bae is mad at you but you just want to hug https://vine.co/v/MD5Xe9teeBT "" my relationship "
"I don't understand how you tweet so negatively EVERYDAY. Life is soo beautiful, what do you have to be mad about all the time?"
"“@NOCHILLMAO: BELIEBERS ARE TRYNNA TO GET THIS OFF THE INTERNET, RT TO SPREAD AND GET THEM MAD http://vine.co/v/MpmhBbxQMZK ”"
Don't be mad when you seeing me doing something with someone else when I was trying to do that with you 
Hahahahaha you mad or naw
See how Bron play when u fuck boys make him mad lol 
People look for reasons to get mad at me haha
Tell Your Girlfriend The Truth  The Lies Hurt Their  and She  Cant Be Mad  Hearing The Truth! Keep Shit  Always 
Moms mad at me for not cleaning my room but like i swear i considered cleaning it
I'm so mad my mom made me a bombass sandwich for lunch :-(
Mad fun night yo
Your mad cuz I can treat your girl better than you did....you shouldn't be jealous you did it to yourself fuck boy
@heathhmcc just got mad at my mom and I because we are cooking something healthy for dinner ... #what
my mom gets mad at me if I don't like her Instagram posts
I get mad fast asf yo
Don't be mad bc you can't have disssss anymore 
I like how mad people get when I tell them that I've never seen the Lion King
lol I think bae is mad @ me :(
My texting speed gets 100 times faster when I'm mad
If I'm mad at you I will just ignore the shit outta you& make you feel bad for yelling at me or doing wrong lmao
"Was broke as a joke ain't never laugh, I went & got it and now they forever mad"
"@Johnyboy_369 we were .1 seconds away!  So damn mad, but we got it though "
I get mad bec you don't show me you want this relationship.
School tomorrow is gonna suck mad balls!
"If you start drama on twitter, mad people will rank you it's just that simple."
I hate people that just be mad at the world 
"Willem de Kooning - Montauk I at Wadsworth Museum in Hartford. 

Mad I missed my art history class… http://instagram.com/p/m3FMJIrBkC/ "
I'm so mad I was literally 100% sure it was Wednesday
“@DamonCRodgers: Teachers be like..  #DamonGang https://vine.co/v/MJDLqBpUUer ”lmfaooo real shit. I me mad af. Like nigga it's flu season.
“@OfficialSeanB_: When bae tries making up after an argument and you're still mad https://twitter.com/OfficialSeanB_/status/454699995539980289/photo/1pic.twitter.com/sDTZS9VDq0 ”
@xSTACHx I'm mad bc I was saving this picture for something but now I can't use it UGH
“@Lindarellaa_: My boyfriend is mad the knicks are losing ” SO AM I 
just mad at myself that I waste time on people and things that aren't even worth it
“@bniceloco: Stop texting and calling your girl while she with me that's mad disrespectful” rns pic.twitter.com/M1gfeCDEIy
I get mad when people say their kendrick #1 fan  knowing damn well they only a fan cause they heard M.a.a.D city
Dont be mad that i'm doin me better than you doin you
It gets me mad when people are working out this time of year just for prom & then they stop.. Like it should be something u do all year long
"I hate going to sleep mad, it's the same thing every night"
They really changed the SATs. Like I'm mad about it.
If Leonardo DiCaprio does not win an Oscar for Wolf on Wall Street tonight..the whole system is corrupt and I will be so mad
If i was zo right now i woulda been mad af
Month 3: still mad Drop Dead unfollowed me
"Don't get mad, get even!"
- Im just being honest & your mad because ? Explain ? 
When a 22 year old gets mad at you for shitting on BVB >
Lil Georgie just mad his jawn (@h_grabowski ) like me better
i'm just mad how it started over tony tedone.. 
I'm mad I just found out @joeyBADASS_ @DirtySanchez47 are in new haven tonight.
My mom woke me up saying 'every great guy should wake up to something sweet on a day like today' and gave me a huge smooch and mad chocolate
Have you ever been so mad that you can't explain how mad you are but when you do it sounds like gibberish?
IM SOOO MAD ........... pic.twitter.com/BHibyGz4u3
Erin just threw my phone against the wall but I can't even be mad bc she bought me Dunkin
I'm mad bored Whos tryna do somthing
"When I'm mad at someone I just stop talkin to them until I'm not mad anymore cause if we talk ima be mad Blunt , Dry & Rude"
- hellooooo there your eyess>>>>> and you're mad cool
I'm single so don't be mad if guys try getting with me. If your mad? then cuff my ass other than that stfu.
People really got mad at the Doritos commercial where the foreigners sang the national anthem in diff languages? Ignorance at its finest
"I can't stand bitches, once they stop likin u they link up wit other bitches that don't like u & now it's a squad of mad ass bitches"
Honestly I'm not even mad I have to go back to school. It's senior year and I already got into college...
I get mad at little things
“@Bob_Cousy14: I hate when people get mad at you when you make a mistake but when they make one they don't want to hear shit”
So mad it's snowing today... Like you couldn't do this yesterday?
Don't get mad get vodka
Bloomfield feel mad foreign to me now.
when one of your followers on Instagram shows mad love & you don't follow back so you can't show love 
I HATE being so mad to the point I wanna cry. 
"Just remember, YOU didn't want this, so don't get mad at me for looking in the other direction."
"My fav is seeing people tweeting about how mad they get when one person unfollows them, it's like the end of the world to them"
Don't be mad cause I'm doing me better than you're doing you
Wish I can take back the shit I say when I'm mad cus I don't mean it most the time
When im mad im better off alone
"Imagine how mad Bryan would get right now if Big Jim says, ""hey Bry how come come the mouse on this thing isn't working"""
Girls on IG posting hella thirst taps but wanna get mad when they get a dick pic in they inbox smh
I love Richard Sherman lol he's mad funny and he talks mad shit
“@LilSwaggaBoy910: LMFAO YOOO.  OLD DUDE GOT MAD AS HELL >https://vine.co/v/hxr6OJDiB92 ”
"No girl can make me mad over a boy I already had. How are you ""winning"" with old news. It's like you're walking in my old shoes"
"Hot 93.7 tell em why you mad: ""I'm mad because my nephew is sleeping with my ex husband!"" "
SO mad I'm not at this CCU-USC game! but LETS GO COASTALLLLLL!  #ccufootball #bleedteal
Ppl be talking mad shit about Yung lean but still be repping sad boys
Ahhhhh I don't know whether to laugh or be mad lol
Yo I just got mad excited for Wednesday god bless you @CFP_Films
Every time I hear or think about oomf I get mad.
As soon as the period goes at the end of my sentence I'm mad? Maybe I just want to be grammatically correct you little fucker.
Ugh people make me mad
I've had closure by the story so far stuck in my head all day. Not even mad about it though.
"Let me find out you at his place!!!! SOMEBODY GETTEN THE D*** TODAY!!!!“@angelashardae: it's mad cold in here , glen needa get it together.”"
You call yourself a music fan but you'll trash everything that isn't by your favorite artist? You're just mad other people think it's good.
Makes me mad that all these dudes lifting less weight than me look way bigger 
"Why would a tall bitch leav her crib in some tims then get mad when I dap her up.. u wanna look like a nigga, then get treated like a nigga"
Do you know how mad I am that the cd I got isn't explicit @MileyCyrus  gotta buy another one 
In the Bettas and mad people jamming out to biggie
"If your girl is mad at you sit down and talk to her, ya be on some gay shit trynna have a attitude just like a bitch."
What a nigga gotta do to keep a females happy ? All the little things get them mad !
"Hey this is Hot 93.7. Bristol Eastern, tell em why you mad?"
Girls aren't bipolar were just mad you don't read our minds and do everything we want 100% of the time
#PerksOfDatingMe you could fuck the based god I won't even get mad
Good girls be mad bc hoes getting wifed but honestly hoes are just easier
"Everyone's like ""sweatshirt weather"" but in two weeks were all gonna be mad as as shit when it's snowing."
Soccer players are mad cute
I'm mad he text like that too
When I get home imma get mad cooked just cause
So Niemi is rated an 84 in NHL 14 and Burns is 87 even though he was listed as an 89 in EA Sports Top 50. They're just mad SJ swept VAN
All the hoes mad they cant go out looking like hookers today
Last night was mad chill
"#LifeLessons people don't get you mad , you get yourself mad."
So mad i have to wear my glasses like the first week 
"yall caught mad balls throughout the summer. 
let's see how it goes tomorrow."
What I do when im mad at my boss #poundingPB #stillgotaraisepic.twitter.com/T7r51V5YST
i'm mad but i find this as like the ulimate trolling.
mom wasnt even mad about the ticket
Following me on twitter then being mad at my tweets is listening to Lil B music and then talking about how much you hate him
"When females get mad at you and never tell you why but ""I'm mad at you"" if I had a quarter for each time I heard that in life"
If you wanna be a model you have to get naked in front of mad ppl js
"You know Lisa's mad at you when the last thing she says to me when she leaves is ""shove it up your fucking ass"""
"you can't be mad at a for being a  it's in their nature to do what they do , you can only be mad at yourself for fucking with them"
lol he's getting his girlfriend tampons at 8:30 at night. mad respect.
My weakness is that I can't stay mad at people I like for anything
TELL ME WHAT THEY MAD FO!!!!!!
@nickydonmtv it's mad hot
“@TairahMerrill: Kid cudi - paper planes freestyle .” Mad dope
all of my little brothers track teammates know me as badbetchmiller... thts not okay
Rs everybody who said mc donalds delete yah tweet yah makin me mad BK WE STR8
I Need Rico Right Now ! He Might B Mad At Me But I Need Him Now
If my mom left for a weekend I would throw a get together my house mad big
; People are always so mad like be happy .
"Deme is the only boy to keep shit 100% with me, I got mad respect for him"
@keeyahnaxo it ain't my fault u mad u should of listen to me in the first place told u u can't Tell me bout my own blood lmfao right back!
"@yahairaharris_ idgaf if you asked god , NO IS THE ANSWER YOU MAD ?"
Shannon is mad cause Valentina look better then her !
"if you're perfectly chill and someone asks ""why are you so mad"" its gunna get you mad like thats just how the brain works idk"
Nagle mad rampy in her full brown zebra suit watch out
"Super Super mad night.
Fucking pissed as hell. 
Want to cry my eyes out,
Cause I'm in fucking hell."
"Yall act the same i hate going places where yalll both be there , Cause tay tay and them was mad i wasnt gonna be with them i was torn."
I want da kind of relationship w/ a white girl who's gonna call me a nigger wen she gets mad so Ik she was racist nd alwys wanted to say it
"My dad goes follow me on twitter lmao i said okay , he was mad hype to give me his twitter name , i just wanted it to block him "
I hate opening a text that I know is going to make me mad
mad respect to my fellow seniors #family
@DUB_CT3 @deeDILLIONS that sh** be gettin me mad lol
Lexie and I are so mad right now lol you guys better get ready to work!!!!!
“@Kbeazyy: I wanna make a harlem shake video” made one wit my boys mad funny
If I had mad money I would hook all my friends up.
Since everyone keeps asking and being noisy And hating on my God damn life. Yes me & @Madison_Tnt talk. Mad? Get the hell over it.
"hey guys I don't know @alexacuted, but she got pretty mad when I pointed out how average looking John Mayer is. I legit lol'd at that reply."
"I think I went to misquamicut over 20 times last summer, def going mad times again this summer"
S/O to all you Task Force haters I know you mad cause my TL is straight BASED right now
Stuart from Mad TV.. lmfao I miss him so much
I hate when you're single no girls want to talk to you but as soon as you get into a relationship MAD girls want to talk to you smh
"To all you ""rappers"" that are getting mad that we keep tweeting #SignJC. Cleary you wasn't good,so don't hate. And unfollow me,I have more."
I'm actually about to unfollow mad people cause i hate all of you.
mad awkward that we left @mmoods93 at the house and just went bowling
We are playing Mad gab and I want to kill everyone.
"@alexisstermini @cuteboiii101 @gb_ohgod @wwb10993 lol I'm sayin, mad fun though!"
@_SheLovesDree we was mad deep at the jerry springer show today shout out to my brother sleighdro.....I just felt like sayin dat
Maury is mad entertaining lol
I'm just ready to swag out tonight and take mad pics 
"@JellyOrtiz_ @joeymaldonado_ that's mad cute , wish ya the best & for Christmas Im'a get my girlfriend the cool grey 9's & the kill Roy's 9s"
Talkin about weak ass fans somebody mad 
Anyone mad right now?
"We may argue, fight, cry, get mad at each other, but nothing will break us apart <3 @ovoxo_bp"
I have mad respect for the people that are up right now and going to work fuck the ones bitching about waking up at 10 #onaregrind
#ICantStandWhen you push my buttons and then get mad at me when I flip out on you.
Ill be mad if that happens honestly
I can never stay mad with him
When @ana_catarina34 gets mad she be going in watch out 
"I don't even get mad anymore, because I expect certain things from certain people."
Never go to bed mad.
“@BryannaFudge: @Evaaaan @cvpitvl @q_pac_2 @quintinralph I have no reasons to be mad. I still got my boyfriend so ?” Your a fool slore
"Mac & Webby the whole way home, and I ain't mad about it"
Bae get mad wen i call other ppl my girlfriend lol its cute tho
I forgot today was double period lab!... I'm mad af
i got mad love for this girl and her children regardless of what went down/goes down ima always be here for ya @Vany_bby_88 #ConfessionNight
Damn!! My husband @iismichelle is lookin mad fine in her twitter avi. #BATMAN2012 #myhusbandishotterthanyou #killyourself
"Damnn, It Aint Even Been A Full 24 Hours & Donald Trump ALREADY Talking Shit About #Obama ..Nigga You Mad?"
"3 lies from guys: I'm sorry, I love you, I won't hurt you .... 3 lies from girls: I'm fine, I'm not mad at you, I don't love you."
When people try to get me mad. I just smile in there face #kanye
At Mad Dawgs with @Spartanwolf1337 visiting @HeatherLynnsays :)
the fact that she don't even kno I'm mad at her makes me even more mad
Yo it's mad funny trynna watch @chinx_dourx3 do push-ups and sit-ups
Whenever I'm mad I just want to get a ton of face tattoos
@iMartyM i don't know what your mad at but just blow it up
Why Would I Judge Anybody That Chooses To Twitpic Her Boobies For #NoBraWednesday....I Dey Mad? Carry On With Your Foolishness Please :-)
"Dude, chill! Mad cops! @devswagalicious"
"A real boyfriend knows his girl like the back of his hand . He knows when she's mad , sad , hurt&' angery .because thats his girl.!"
"We Nigerians Can NOT Enjoy Anything Except There's Comparison & Drama Involved...Just Enjoy WizKid's Mad Jam...Leave Mr.""Dimples"" Alone."
Drake mad as hell haha
One way you can get me mad is by hanging up on my face! <<
"@oMaRi2timez forreal man the school felt mad weird with out you, Eric Shawn and everyone man /: I miss you too come up here nigga"
Yaa bitch chose nigga don't be mad.
Mad I couldn't watch the game
I'm mad that I'm inserting my commentary into this fool's conversation. We out here geekin ls.
Wtf -__- fuck westfarms they cuffed me up and shit then said it was a mistake cause of my common ass hilfiger shirt -____- Im really mad af
I'm happy. You're not. That's why you mad doe!
"I'm not hitting nobody up no more , I always show mad love & get none back ."
@_dollfacesx3 Rs. Let Her Talk She Obviously Mad.  Your Cute Af. Let Her Lame Ass Rock.
that lightening was mad bright
#followfriday -------->@she_mad_yo         she WILL follow you back
MAD SNAIL DISEASE
#FactsAboutMe wen I'm mad I keep it inside
Today was mad funny.
