"i don't even get mad anymore, i get distant."
I get so mad when I see people kill other people’s vibes when they’re excited about something
Y’all really mad at single niggas doing single shit? 
"Other people being mad at you is easy to deal with , being ma at your self? There's no escaping or leaving the room"
"This actually kind of makes me more mad or frustrated about stuff than i normally am tbh. Were all human beings, we all have brains, were all wired differently, and thats ok. So if idc about what youre saying thats actually p normal and okay."
I think people sometimes get mad or annoyed with me when i am myself... and think that im being extra or a dick to be funny or get under someones skin.
"I don't even want to know why, it's like impossible to get mad at hamsters"
"anyone mad at the new overwatch hero being an adorable hamster is actually an inferior human being, just accept our new hamster overlords"
"Remember when they cut platinum benefits, added them all to one tournament, and everyone got really mad?"
"My mom came into my room and was mad serious, saying  I have to start being “nice” to guys because one day ima have a man and shit, like lady ima be single foevaaaa... NICE FOR WHAT THO."
My baby is mad delicious 
Just starting to see the silver creep into my hair and I'm not mad about it. pic.twitter.com/1XnRYMWoLg
That’ll forever sound mad good
LMAOOOO okay now im fired up and i cant sleep. and i cant even go on my roof because it was raining and now its wet. can someone likeeeee call me or something because I'm so mad!!!!!
“Ariana Grande could say dyke and I wouldn’t be mad”
if gen 8 has unskippable 4+ minute cutscenes like gen 7 I'm gonna actually be mad
"John Holowitz talks about how he was able to finesse an interview with GZA & DJ Symphony showing mad love.

Click the link for the full clip. If you enjoy the clip definitely also check out our full podcast with John on our channel.

https://youtu.be/nlBuInWHEa8 pic.twitter.com/pk0LKEhxFP"
I was a Hillary all the way woman. Over it. Time to move on. Im thrilled! New blood is a good thing. And I'm certainly not mad at a real progressive agenda! Let go of 2016! This looks like winning to me!
I know it’s mad early but.......5 hours until @JoeBuddenPod come on!!!!  Best part of my work week. Anticipating mad gunshots pic.twitter.com/Qn06PoNYxf
I'm not mad at HD and I'm a Harley owner.
Only the loser stays mad.. #keepworking #blessed #zumusick #aartmajor #zenujlife #junebrone https://www.instagram.com/p/BklIsrulcL4/?utm_source=ig_twitter_share&igshid=1y07yizilhb7c …
"MAD #BDE from every one of these beautiful mofos!! @brendonurie @iamjonwalker @TheSpencerSmith @thisisryanross
ohhhhhhhhhhhhhhhhhhhhhh and my boyfriend Tom, also! love ya babe.pic.twitter.com/rT5w7V5imA"
I liked a @YouTube video http://youtu.be/Fg_x3sjz5Fo?a  NINJA GETS MAD AT COURAGE AND ALMOST REMOVES HIM! | Fortnite Epic & Funny Moments
"How do? Literally got mad good jawns,bums, and music playing all the time"
I only like natural light during the day so my crib be mad dark when it’s ugly out
Bout to take candid pics in mad different outfits.
Don’t talk about your ex you know he mad
I secretly LOVE the new SoS set on my warlock. I put the mad monk shader on it and it looks so legit.
Long Gone Day Mad Season
I got the key to this BBQ restaurant I deliver to and I am MAD tempted to go in and make a plate but I'd get  for that....//
I'm Above Mad Season
"I legit get mad when people say the problem with A Hat in Time is ""It has JonTron in it :c"" and not fucking Jonas Kaerlev."
Haha dude did you have to google the spelling of her name to make up this totally not mad and baseless smear tweet?
I start to think about things and get my self mad all over again 
Going through my old videos and here I find the perfect example of how I get mad at everything  pic.twitter.com/1Ps2f9Yrsn
People get mad at you once you start seeing things for what they are  sorry boo your true colors are showing can’t unmask it
There are too many White People mad in the comments. Lol. Stay Mad
If you felt like I did something wrong please tell me I’d rather know then have u be mad at me for something that I can/ cant fix.
yoooooo hawaiian punch while high is mad good LOL
"“Woke” People on twitter get mad at Latinos who don’t recognize their blackness, but the ones that identify afrolatino and/or say the n word get come at and told they’re not black. Bro they never satisfied lmaoo"
Yall are grown ass adults mad that other grown ass adults have kids when you try hitting on them. Lmaoo thats what happens with age— procreation.
Mad asf my boyfriends working until 3 & I go into work at 3 https://twitter.com/jahayranavarro5/status/1012332774982934533 …
"Today is a day to just stay in watch movies, have sex, and eat "
mad skills.
Nice! Congrats!
"I'm just trying to be a better father than the one I had 

So I set the bar mad low...... E-Z "
"If another chick texts you and yours knows about it, but don’t get mad. Somethings up"
"This comes from a TON of personal experience with my own family, and letting them ask the uncomfortable questions really helped them learn and grow over the course of the past 6-7 years. I’d much rather have somewhat educated family than complete ignorance to get mad about."
When shes talkin about past lovers you get mad at the thought of her giving ass to others ...
Meanmuggin ever since. Think I was mad cus I had boxers on lol pic.twitter.com/26eDRXEHij
Nbs it makes me so mad bc the law really don’t protect ppl against stalking intill it’s wayyyyy too late
"McConnell is a craven, power mad sadist. He couldn't be more pleased. I can smell the decay from here!"
I thought it was only dudes who fuckin send you mad shit after you not responding.. But there's this one girl bro like bye we both got a man LMAOOOO
Bruh heads that don’t smoke honestly b mad weird
Lol He mad 
Woke up to mad ppl telling me how this teyana Taylor album is like without giving me a chance to listen 
lmaoooo non black poc be so mad when you tell them they dont get the nigga pass
"I realized I haven’t really posted any memes in a while, so you guys are getting mad of ‘em today. pic.twitter.com/MqIJxRQbT8"
"I’m the mean Mom who laughed heartily at her furious infant daughter who was fussing in her car seat after getting her shots. Thinking “you might be mad, but I’m keeping you safe”. She’s 19 now and my son is 17. Both fully vaccinated and healthy."
"Bitches gettin mad, I’m gettin money. We NOT the same"
Men get jealous/mad off of the dumbest shit
"I don’t like being catcalled, POC don’t like being confronted by the police while conducting normal activities, elementary schools don’t like to be confronted by white extremist shooters so.....I mean  sorry if you’re mad you can’t get good tacos https://twitter.com/thehill/status/1011351339085987841 …"
"Schumer responds to Maxine Waters: It's ""not American"" to call for Trump officials to be confronted in public http://hill.cm/kzOgELL  pic.twitter.com/7CPkZJRZ4D"
im mad motivated rn. I need to get better
Lmaoo I’ve had mad time today.
I guess asking @dog_rates to their thought on your dogs is a thing... What about my American Bulldog mix #SunnyDaze ?pic.twitter.com/fLXkdxLvIX
I’m real mad right now 
This WC has been mad but I love it
I’m mad I forgot my water in class lol
"I’m not watching this anymore, I’m mad as hell"
Honest to god really am starting to not like becca. Colton goes and is honest to you about his PAST and your mad? Grow up.
Anyways I woke up mad and I’m ready to fight everyone.
Wake Up [Lyrics] Mad Season
"I’m mad tan outta no where, I should’ve been a FBI agent or something I look like a different person every other day "
family group chats literally turn into me and dan and don just sending gifs to each other and my dad getting mad
I really had to deal with mad people’s shit today at work like please leave your home problems at home
"I get so offended when people dont like one direction or any musician I love, but when anybody shows an inkling of liking them I get super mad and protective... just can’t win "
I’m really annoyed because I wanted to go out in Portland and I even offered to drive because I’m not drinking and NO ONE WOULD GO WITH ME AND I’m MAD NOW
i lost respect for mad ppl this year lol
Great pic of him with the  trickling down!
Bruh step dad sounding like the way to go... looks like mad fun on pornhub
"Daaaaaamn. He is MAD AS FUCK!! Get'em, Dr. Now! PISSED!#my600lblife"
me when i’m mad at my bf and don’t want affection but really i do https://twitter.com/catcontent/status/1012014961810378752 …
pic.twitter.com/UxojmpGJTq
There’s being jokingly mean bc you’re mad at someone (which still isn’t right) and then there’s being mad at someone so you attack them for the one thing that everyone knows hits a really dark and sensitive spot and if you’re the latter feel free to never contact me again
I liked a @YouTube video http://youtu.be/JXMRK4krz-E?a  It's Really Mad | Pokémon | Cartoon Network
I couldn’t even be mad so I just laughed 
No bullshit. Today was mad funny lmao
Unsaved numbers be so mad
Im mad cus the girl next to me had lq in a ice tea bottle lmfao
In the Dark makes me so mad every week.
November Hotel Mad Season
Of course of all days this train is running mad late
Do you ever just rub your eyes at night? Shit feels mad good
I guess I’m an inactivist bc all of the activism today just makes me mad. Let’s just bake cookies and be nice to each other
Im so mad we aren’t roommates
I'm Above Mad Season
mad people gonna follow @Strodead tonight only too be greeted by anime tiddies on tiddies
When they Mad you on WBRU 101.1 fm C’MON SON we all winning #laughintherefacepic.twitter.com/Uj9uMK2oRz
Almost bought this cute ass swimsuit today but it showed too much cheek and side boob and my mom woulda been mad 
"Sometimes people will like you and you won’t like them back, other times you will like someone and they won’t like you back. It happens but you can’t get mad someone doesn’t feel the same lol. pic.twitter.com/aQuEiOV92W"
"If you’re mad that’s too bad, sounds like a personal issue"
I'm actually mad that Jake wrote a song so good its been stuck in my head for almost a month.
"Our Lily  your dancing lovely, your acting exquisite  lovely Alice! “We’re all mad here. I’m mad. You’re mad.”"
I’m mad
I wasn’t even mad lmao
"I love this guy...true story, he randomly worked out on a treadmill next to me prepping for the ‘94 World Cup and kept reaching over and raising my incline like a mad man. I was some random 24 YO kid from Boston and here I was working out next to a soccer God."
"I’ve noticed that whenever my feed gets super depressing, my own posts get veryyyyy queer. I’m not mad at myself."
"I get jealous, I get mad, I get worried, I get curious, that's only because I care!"
Bitches be mad were the BMs bitch were fucking mad too tf  @Silee___
This month been mad depressing. So many tragic deaths . Tf is goin on
Plus the freaking books mad expensive for no reason.  Just a Summer session math and really ??? That much.
Hopefully my boss won’t be mad!
I be making some of these girls feel mad stupid
lol these refs are mad racist lol
Wake Up [Lyrics] Mad Season
“I was playing Tetris at work and my boss got mad at me” well yea
Lol you’re obviously mad about it to post
He’s laughing still and I’m gettin mad  @Joey200313
"im in bed at 9:25p on a friday & honestly, im not even mad about it"
"When I get mad at people I stay silent, cuz if I speak my mind , shits gone get real ."
"When I get mad I shut down. You won’t see me explode, you won’t see me period"
Chicks really be tweeting like dead hoes. Then mad if you say they hoes. Well then lol
The people getting mad at people caring bout whatever going on with Kylie is just as weird lol
"Not quite Art Deco, A bit more ""Mod""/Mad Men in this cake! ⠀
Book a tasting with us today… https://www.instagram.com/p/Beit4gTHLRl/ "
Girls will talk mad shit bout chicks doing shit only to turn around and do that same shit. Stupid whores
More like drunk elf! - Drinking a Mad Elf (2017) by @TroegsBeer @ Abott Run Brook Tavern  — http://untp.beer/s/c539681785  #photo
"I Know Why They Mad  @ Providence, Rhode Island https://www.instagram.com/p/Bb7zjQPFgGLr2rJLa1wV7wYR-p8K7phKASP7LE0/ …"
"Alice: This is impossible. 
The Mad Hatter: Only if you believe it is. 
Lewis Carroll | Alice… https://www.instagram.com/p/BatIssKFHxT/ "
"Mad Hatter Tea Party #BeatStetson @ Providence, Rhode Island https://www.instagram.com/p/BZ2K3TmF0aK93GIID73vSzwjNpR5JcKvp284qI0/ …"
"#halloween in Providence is going to be mad house
elderband, blackpyramidband _dirt_devil_ ,… https://www.instagram.com/p/BZw1ctOAwqe/ "
| mad hatter @ Aline Sarkis Beauty https://www.instagram.com/p/BZhdLDZhdUe/ 
lol girls tweet the craziest shit. But get mad if you say they hoes for it
Don't disrespect Gucci RT @im_ANA_roll_: I'm not mad Gucci mane is in this song but it shoulda been you @theweeknd pic.twitter.com/itQbH4wfLI
"Most dudes be mad corny now but I think the worst is a ""do it for the gram/snap"" ass nigga. I'll never relate to those guys."
Hayward bout to fuck MAD CV hoes omg
These next few weekends it's just a big forecast of alcohol. MAD alcohol.
My BM really mad at me cause I went out last night. No Happy Mother's Day for her.
So much fun at lakeviewpavilion working alongside @mad_ruthless  @montilios  @bossbabe_regina… https://www.instagram.com/p/BUEovkLFVmf/ 
not mad at that
So we’re watching Frosty Returns. I see the name Elizabeth Moss. The same from Mad Men? I checked IMDb. Yep. #CBS
2016 edition. - Drinking a Mad Elf by @TroegsBeer @ Abott Run Brook Tavern  — http://untp.beer/s/c385297974  #photo
"Alice: This is impossible.
The Mad Hatter: Only if you think it is.
Make it happen.
Have a… https://www.instagram.com/p/BKSzLZzjLPc/ "
Really spent mad money this past week
"Happy Bday to my Godfather, despite being a Cheesehead (Greenbay Packers fan) i got mad love for… https://www.instagram.com/p/BI2viD1BHEd/ "
So mad My phone died when luke Bryan sang let's get it on by #marvingaye
"Yesterday was definitely MAD decent.. got to see fellow MIMAN @katcorny killing it as always,… https://www.instagram.com/p/BH13ek5BCEW/ "
This me! RT @Lykos14: need my brakes fixed asap my car's making the craziest noise lol mad embarrassing.
Not even mad. That's amazing. @ Gillette Stadium https://www.instagram.com/p/BDBFRjfoUVE/ 
I'm going to bed because now I'm mad 
Mad cheesin vimeo x @hackatbrown #hackatbrown2016 #vimeojobs @ Brown University https://www.instagram.com/p/BBdhVSOHi-K/ 
"Refused to buy Kaylee a vape pen and now she's mad at me because I've  ruined her chances of becoming a ""vape god""."
"People walk Into Wendy's with some name like ""Shanaynay"" and then get mad when you forget a letter."
"I'm mad annoyed, like supppper salty"
strongest kid loads #tree onto #momwagon at the corner nursery.  #buylocal #hohoho @ Blooming Mad… https://www.instagram.com/p/_Fo55BRnMg/ 
"@CThroughHaters put in work on the field, got big things coming for you bro ! Congrats mad proud of you"
"Texts that make me mad:

1. Yeah

2. Oh

3. Yup

4. Lol

5. Haha

6. K

7. Nope

8. Chillin

9. Naw

10.?"" < how @CSaintis texts and replies"
"#wheresBIGTUNEZ

Last night opening up for @MachineGunKelly ’s #RoudTrippinTour

SONG: Coco (Mad… https://instagram.com/p/9bNlbFGUhA/ "
@paradoxcrolly i feel you but imma still be mad salty
Y'all getting mad when you cant find love at such a young age cuz y'all never take time to love yourself.
When Dad gets mad at you for not buying #NERevs tickets in the FORT...http://nerevs.us/SA8pk 
I remember everything people say whenever they're in a bad mood or mad cause that's when their filter goes away and they say what they mean.
"Again, v thankful for sisters who you can always count on giving you mad comments/likes on your insta pics #blessed"
I just love when boys dm me & I don't reply so they get mad & unfollow me
"Love the ""mad libs"" - My 1st Week at Wheaton! @wheaton Welcome to Wheaton Day @wheatondeankate @svivepic.twitter.com/P1HPU9dt2g"
It's ridiculous how easily I get mad & I get mad over the smallest shit .
Robby's Mad pic.twitter.com/fSxuejv0TE
Canucks fans still getting mad at ME because I make a comment that they destroyed their city in 2011. My bad because you people rioted
"@DWTS20 @MsPattiPatti Poor thing, god bless her. You have to give mad props to that lady. # BetterWithAge. "
I think it's mad weird that I spent the last 17 years of my life going to bed at night with the tv on and now I just don't do it anymore.
"I have 3 types of mad: when I'm so mad I cry, when I'm mad and just snap, and when I'm mad and just don't want to talk to nobody"
"“@SexualGif: When bae makes you mad
https://vine.co/v/OXYbugwAvbW ” ?!?!!?!"
"Dear Thursday, I'm mad at you."
So mad at my self for falling asleep instead of getting free pancakes yesterday
"Being confident in yourself is so rare that people actually get mad at you if you are,"
I get mad SOO easily 
Last week Chris Studley walked into my class room and I truly have never been more mad. Thank the lord he was in the wrong class
"It has taken two years to answer this but ""No I am not mad...bro.""  But thank you for asking."
"Hey Seahawks Fans, You Mad Bro?"
U MAD BRO!?!?!?!?! @RSherman_25
Was just about to get very mad at Verizon cable.
If you're mad because you can't see your bfs bestfriends on snap you should probably be with someone you trust instead idk
"If we're talking & I see you flirt with someone else I'm going to fall back & let you do you 
but don't be mad when I do the same"
"I will try so hard to keep my cool if i'm mad because I know how I am, i'll kill you w, my words."
"If you're mad well too bad, sounds like a personal issue"
After a break up niggas love to get mad and call you a thot  please don't go there baby boy.
People Twitter trolling because they're mad that their teams players made a stupid move LOL
Despite the tough loss... Probably scored the best goal of my life tonight. Cant be mad with going home with 2 goals and 1 assist.
People get mad when you don't trust them but they the reason why you don't  trust em in the first place 
not exaggerating; i looked for my retainer for 2 & a half hours & i just found it at the bottom of my trash i cant tell if im mad or happy
more mad at the fact that i'm probably gonna hear Dana Desmarais talk to me about Cumberland allllll during class tomorrow.
Instead of studying for my Algebra 2 exam I'm going to research ways to convince my mom not to be mad at me when I fail it
When you realize you have mad homework due tmrw that you haven't started pic.twitter.com/arrV8gQqf3
"if someone is mad at me, I like to laugh bc that gets them sooo much more mad hahaha"
When I get mad I stay quiet 
kinda mad that i still haven't seen a day to remember live.
When bae gets mad at you and you gotta buy her a present ........ pic.twitter.com/BlFNtrbUUY
"Nothing makes you feel more guilty than getting the ""We're not mad, We're just disappointed"" line from your parents"
Thanksgiving eve. That means get shit faced and cure the hangover with mad food in the morning
You gone be mad you passed me up in the future....just saying 
We got mad leaves here in Rhode Island!  pic.twitter.com/XP4HOsXL5Q
Girls legit become vicious when they're mad a guy chose you over them #SorryNotSorry #HisChoice
Im so mad erikas up right now
The thing that gets me mad is when they have these tweets that says rt or you or your family members will die the next day like wtf!!????
"Our suite turned up last night to Mad Men and pizza, so yeah it was better than your night"
never forget what someone says to you when they are mad
Mad gig tonight #Boston!! Enjoy @edsheeran's show and come and party with us @nagacambridge later!
If ray rice somehow only gets his 2 game suspension.... I can only imagine what the other teams are going to do. Players are mad
"I've been in bed since 3, and I am 0% mad about it"
@Amberleighx0o yo you're mad creepy LMFAO! pic.twitter.com/Rga2IdDR0t
I peep mad shit I just let it be.
I SPENT LIKE 2 HOURS DOING OPTIONAL SUMMER READING WORK THEN REALIZED I DONT EVEN HAVE ENGLISH UNTIL NEXT TRIMESTER. IM SO MAD.
 I'm mad I get this pic.twitter.com/ojvXRMbN7p
If someone could explain the logic behind boys punching walls when they're mad... lemme know
This Alabama vs West Virginia game is mad competitive 
I loose my appetite when I'm mad
Lol This summer was not as hot at all but now that august is ending it wants to be mad hot !
In Levis these girls got mad at me for walking past a mirror while they were taking selfies.... Ha
Mad funny that these kids be drinkin and smokin now but used to judge 
My girlfriend makes me mad like no one else can
People stab you in the back and then all of a sudden they're mad desperate for you. Swerve
I think one of my favorite things is being overly nice to miserable people because it makes them so mad
Kush mad me like.. pic.twitter.com/NLlTVMAcVx
Not knowing what you did to get a person mad at you is the worst feeling
"Just had the most intense hunger games-esque dream, so much pain was endured but I won, awoke to calf and foot cramp from mad activity"
Imagine living in a world where money didnt exists & everybody was just mad united & worked just to be helpful & everything was free  
I don't even need to get mad at people Dias does it for me
are ppl really mad about a damn picture or just joking bc either way u childish
"take a minute and tell your friends how much they mean to you, rn, sounds mad corny but give it a try"
someONE TOOK MY FLOWER LAST NIGHT FROM MY HEAD AND IM MAD
Not gunna lie I miss the old days where the crew always stuck together and hung out  back when I had mad people over and we were reckless 
"""@KingRelloOMG: When females say 

Okay = not mad  
Ok = mad 
K = mad af 

It's levels to this shit """
I hate when people talk to you all day & tell you you're cute & show mad interest & ignore you every day after that like why ?
I observe mad shit about people son
Don't be mad because I'm riding your ass. I'm trying to read your stupid fucking bumper stickers to see how much of an idiot you are.
he got so mad so fast lmaooo pic.twitter.com/hCKjrnAmPE
 you thot u were so cute the other day flirting with Chris I seen you mackin' it..o yea cause I was right there. Mad real. Hilarious.
"One day she'll start sending you mixed signals, and you'll get mad because she finally figured out how to play your game"
"Today i realized that Wiz Khalifa was mad significant during my high school years.. ""The Thrill"" sound tracked all my blunt cruises"
mad or nah pic.twitter.com/BkqeqUD3Di
"get me mad enough, see what happens."
There's literally no point of being mad about that shit that you can't control or about shit that happened in the past #Newmindset 
I'm so mad yo that I dropped all my hoes for you and now I can't pick em back up
"""I'm literally so mad at my dad he took my oyster crackers so I haven't spoken to him all day"""
"If anything, you made me stronger. So I ain't even mad."
Im lowkey sad/mad rn
"@Forgotata @jake_eosco @xo_nyasiaa you're mad little, take this off twitter hahah "
Do ya thing I ain't even mad 
"""@lifeofnatalie_: When people tell me I have mad ""friends"" pic.twitter.com/le4Ug9I1kv"""
Looking at clothes online makes me mad because I can't have them right now
Girls get so mad that they can't find the right guy yet they give no guy that actually cares a chance
If your gonna be mad at someone for having friends other than you then your not a friend at all.
Dude really killed all those people in Cali because he was mad that he was a virgin....smh pay for a prostitute and get over yourself bruh
"my timeline:

PK sucks
#NHL15Bergeron 
Bergy is the best
Some random girl mad at her ""bae""
Jake quoting Stannis
More #NHL15Bergeron"
@omaguire15 @jcwollenhaupt so disrespectful. Like legit. This is making me mad and I don't even speak up on this kinda shit.
My dad just got mad at me becuase he didn't like my ringer for when I get texts ok
I had to unfollow Erica Mena. Shes mad conceited and annoying.
everything at pacsun is so cute but it's so expensive and it makes me mad
"""@Boooooney: Donald Sterling's daughter after game 3 win over Warriors... Now I see why he's mad  https://twitter.com/Boooooney/status/460211644551811073/photo/1pic.twitter.com/RpKJPivvWK """
Why the fuck hasn't Apple mad a Spoked B emoji?!
@_lickmy_lebrons i love you baby girl dont be mad
Girls that think they're mad hot and act all conceited and shit are helllla annoying
"Makes me laugh when kids hit you up all the time and then try to act tough in front of their friends, when you have mad texts from them"
Everyone in my house is currently mad at eachother  so no one cooked dinner  lmao #starving #guessillmakeasandwich 
Really getting sick of that are you mad or nah shit.
“@mikeyhoe_: .... https://twitter.com/mikeyhoe_/status/440611058232074240/photo/1pic.twitter.com/wEfdKVJ9XM ” I got mad . 
Girls get mad amped up just cause they have a nice body.... But your face is still ugly as shit
I'll never understand why people get mad when others drunk text them. Please drunk text me I need a good laugh sometimes
[Frozen] @ASTROSTEEZPCP this video Finna make mad people #mad #madboys YUNG HATE 9 PM tonight
"""If you tea bag my pizza I will be so fucking mad"" - Danielle"
also had mad scary dreams so for some reason I started thinking of @benjamins_myth and @will_nb to make it better but it got worse!???!
Doctor dolittles mad funny like nigga why didn't you just tell people you can talk to animals that's a fresh power
