"My dad still critiques and gets mad at my brothers at bats. Like chill fam, I think he’ll be okay  #AlwaysCoaching"
Why y’all so mad enjoy life
Duke fans mad as fuck 
Still mad I never went to ihop today
Everyone is so mad about Instagram has FaceTime calling that’s just another excuse of why I don’t have to give my number out 
Mad confussed
If you're mad about Bernie. And YOU EITHER DIDN'T VOTE or voted for ANYONE OTHER Than Hillary R. Clinton. Then YOU'RE DIRECTLY RESPONSIBLE FOR the mess we're in RIGHT NOW!
life can be so good I’m done being mad all the time
My little sister just embarrassed me in front of my aunt .... and I’m high key mad af 
Last night was funpic.twitter.com/Ugsd0GlYQ3
"My whole Twitter is wanted food elements, being mad at other people, and being mad at myself lmao"
My dog getting mad at me for yelling at the tv it’s so funny 
People are mad that marvel won’t let them see uncle ben die for a third time lol
that shit be mad annoying  like nigga we don’t even know eachother like that & you talking about you coming to pick me up you wanna chill  https://twitter.com/kelseeynicoleee/status/1011716123954311168 …
Niggas get yo # and do this shit pic.twitter.com/1yw0FkEcA8
Yall dont wanna know how long it took me to get my record player working cause a piece was out of place and I was so mad
"Don’t be mad im cute, be appreciative"
Can’t be mad wen you knew wat it was
Mad Max is probably one of the leader's of Jarrett's/Obama's shadow government--the seditious/treasonous 30K army called Organizing For America to destabilize USA and overthrow the constitutional republic.
"boy if i treated people the way they treated me, they’d be so mad"
Is it petty that I’m mad someone got the exact same tattoo as me a week later or nah?
Last night was mad ill Shoutout @lloydbanks we showed love and he showed it right back dapped us… https://www.instagram.com/p/BdqIooPlKNu/ 
7 years ago today this picture was taken. The school was mad lmao. What are you being for… https://www.instagram.com/p/Ba7L1WolEzA/ 
Mad proud of one of my ESPN mentees who's joining the #Turner Broadcasting Family in #Atlanta… https://www.instagram.com/p/BYM1bZZhPRj/ 
BUT A WAH THIS??? THIS MAD BWOY 'YANKEE TAIL' This is my little brother. A day after his… https://www.instagram.com/p/BS9Q6x6DfkE/ 
This week is going to be mad rough 
"@dmforsunshine_ I saw that people were being ungrateful for a chance you were giving them, so I mad this. pic.twitter.com/BV5hcLWutn"
I get so mad at the end of every episode of @finding_carter cause I now have to wait a week to watch it again 
LMFAO you know he's mad. pic.twitter.com/dId9Z4LlYL
Don't get mad when I put you in ya place
Diary of mad black zombie killer  #TheWalkingDead #DeadBuzz
@seena1118 @_Savage1_ @lex_cornacch @_walt35_ @sydneybear31 @caithughes7 cait searched for that pic in her camera roll for mad long
"meeting girls dads is awesome... like hey im gonna fuk ur daughter
u mad"
I can't stay mad  pic.twitter.com/An6UmRZP13
"I don't even get mad at shit anymore, it's just like, oh ok that's cool I guess"
"Ever cry because you were just mad, or because you feel as if you'll never be good enough .."
@MadDogRadio @GlennDOrdway @jamiedukes Big O & Jamie Dukes killing it on Mad Dog!
I have the SMARTEST mouth when I'm mad 
Smh people are addicted to drugs and my mom gets mad that I eat too many granola bars
When bae is mad at you and doesn't let you hit pic.twitter.com/lAALAZH7EC
“@seancoachevers: @kevconnorsespn talk crap when you're team actually makes the playoffs #DeflateThis” you mad bro?
Is this a fete?! Or is this a mad housssseeee
"When a guy starts kissing on your neck and stuff do other females think, ""damn he's going to be mad af when he taste my perfume/lotion"" "
I wanna throw hands wit someone... I'm not even mad I just wanna fight that's all
"Senior proms gonna be mad fun this year, can't wait"
HIGHKEY mad my RA compared me to Charlie Sheen
Why did we do this we are gonna get mad notifications now pic.twitter.com/9sVRid3UGo
it's supposed to be mad snowy and zito knows it too
It actually makes me so mad that one persons mistake is used to the advantage for another person to tweet about just to get favorites
About to fav mad shit because it looks mad cool
Party was a success it was mad love in the building deff was the best birthday ever 
Lawrence Thomas came through the line like a mad man #CottonBowl
Mad my mom really got trey vineyard vine clothing like we got that type of money
Lmfaooo all this Subbin started off a Picture?Like tf My Primaaa Cute are ya mad?Like ByeLet her liveya cute too
"Whenever I'm mad I cry, not cause im hurt im just so mad lmao"
@ihateteddy @Versake @conconrobyn damn you guys got mad close up there at uconn pic.twitter.com/G36pXdHVUt
Fuck the scoreboard I'm still proud of my homies it was a great fucking game mad love and respect #bcfootball #Ram4life
Lol seniors are mad affffff
Don't be mad when I'm doing me better than your doing you
Mad Bumgarner is MegaMVP
@TheRealDisco @TheEdFerrara @MLW I'm mad. You mad? I'm mad. Damn computer gimmick. That Mr. Mad vs. Mr. Nice Guy -- #helluvadeal brother.
I'd rather just watch a movie in bed and smoke mad blunts and eat mad snacks
Just because you're a feminist doesn't mean that you should get mad at a guy for opening a door for you when he's just trying to be nice.
you ever tryyyy to be mad at someone & they just look at you & you can't be mad at them anymore ????
don't be mad because I'm doing me better than you're doing you
My February self would be so mad at my current self for thinking 50 is cold. Sorry @bobmaxon! #brr
That Cinnamon Apple vine is mad funny lol just imagine seeing it in person
I wouldn't even be mad at the bitch he was fucking with bc YOUR man should have enough respect for you to not fuck with someone else.
@murda_von_ @PoosDaGawd_ nobody sad nor mad over y'all little relationship 
@katiewicander when your friend gets mad at you for posting a bad pic of her  but uses it the next day in a new tweet pic.twitter.com/PcBNWRfOX9
You ever miss someone so much you start getting mad? Lol
Still mad confused how im about to start my senior year of high school. Like where did my life go??????
school hasn't even started and I'm already mad at the school
But why Cory though ? Who could be so mad at him to do this.?
The mad hatters @JeffStoecker @JoeDSports @NBCConnecticut pic.twitter.com/2ox3GplIDr
Niggas will let you go n get mad when you disappear
@Devonator69 @iLikeVinesDaily @Niikkoolaaa LMFAO ITS MAD FUNNY CUZ ITS TRUE
Special shoutout to @Baphomet569 and @eli__pootietang for chillin mad hard these past few days #teamnosleep
I'm mad Rif Raf put out a catchy song cause he raps like B Rad G in the heezy #malibu
The love for this seasoning is real. #OldBay. Only #Marylanders would really understand. I'm mad I… http://instagram.com/p/rApkC9Rmik/ 
I was mad at kaelie so she sent me this #ForgivenButNeverForgottenpic.twitter.com/4OrbrJ3EDK
Everybody with a 5s get mad likes on instagram lmao that camera A1
 she was mad after he said the bugs  https://vine.co/v/MQlPUaF9idr 
Nigga mad cause I came in his town and now I'm fucking his bitch el oh el pic.twitter.com/BAb30vMZCl
Lmao when im mad i talk to much shit 
I be wakin up to mad text  missin out on the night life
When I'm mad I get reallyyyy quiet
“@ZaeWoods20: I'm filled with mad greed and a heart that doesn't bleed ” now that's weird guys @WorkThatMilly @xohmyla
Just got rlly mad bc no one was moving at the green light and then I realized I stopped behind a line of parked cars :)
"I get mad and upset too easy. Starting today I'm so over it, fuck stressing"
mad jelly that @rodrigo_raez is in Peru rn  his pictures on insta tho .. #ineedavacation
I'm mad all these sexual tweets wanna appear on my timeline when it starts to rain... Yal ain't low
Pharrel fashion out the box. But it's just mad wavy. The way he puts it together
Can't tell if I'm mad the lady put whipped cream on my drink or happy she gave me a large when I played for a small.
I can't ever stay mad at someone
When your boyfriend is mad at you pic.twitter.com/3OjTEUo2WZ
"People that ""don't drink sink water""
make me mad"
karelin is mad forgetful
Dr leaves august 11th now not October 20th (Caruso's gonna be mad AF)
MAD respect to anyone who's ever aced the physics final
"""@thefemaleboook: When bae is mad at you but you just want to hug https://vine.co/v/MD5Xe9teeBT "" my relationship "
"I don't understand how you tweet so negatively EVERYDAY. Life is soo beautiful, what do you have to be mad about all the time?"
Don't make decisions when your mad
"“@NOCHILLMAO: BELIEBERS ARE TRYNNA TO GET THIS OFF THE INTERNET, RT TO SPREAD AND GET THEM MAD http://vine.co/v/MpmhBbxQMZK ”"
See how Bron play when u fuck boys make him mad lol 
People look for reasons to get mad at me haha
"If you're mad well too bad, sounds like a personal issue"
Tell Your Girlfriend The Truth  The Lies Hurt Their  and She  Cant Be Mad  Hearing The Truth! Keep Shit  Always 
Moms mad at me for not cleaning my room but like i swear i considered cleaning it
I'm so mad my mom made me a bombass sandwich for lunch :-(
Mad fun night yo
@heathhmcc just got mad at my mom and I because we are cooking something healthy for dinner ... #what
my mom gets mad at me if I don't like her Instagram posts
I get mad fast asf yo
I like how mad people get when I tell them that I've never seen the Lion King
#TeamBianca #TeamBianca #TeamBianca #TeamBianca #TeamBianca #rupaulsdragrace @RuPaulsDragRace @RuPaul  if Courtney wins I'll be mad
People still get mad about getting hit at shows?
My texting speed gets 100 times faster when I'm mad
"If you start drama on twitter, mad people will rank you it's just that simple."
I'm so mad I was literally 100% sure it was Wednesday
“@OfficialSeanB_: When bae tries making up after an argument and you're still mad https://twitter.com/OfficialSeanB_/status/454699995539980289/photo/1pic.twitter.com/sDTZS9VDq0 ”
@xSTACHx I'm mad bc I was saving this picture for something but now I can't use it UGH
“@Lindarellaa_: My boyfriend is mad the knicks are losing ” SO AM I 
My BrotherHood niggas @Herm_BH @Beezy_BH @HILIFE860 better be rocking shit tonight !!!  mad I can't go
Dnt Get me MAD THO Ima Tell You how I feel #StraightLikeThat
Im learning not to get mad at everything
I'm such a bitch when I'm mad
"sometimes I get so mad my words don't even come out right, that needs to stop"
Dont be mad that i'm doin me better than you doin you
“@SiNGLEMAN98: Mad af I looked  pic.twitter.com/4Zi8BUiEXs”
"""You talk mad shit dilley""- deb (Eric's mom)"
@RespctThePouch You all mad why can't people be happy & support a team especially if the team is from Bridgeport lol
It gets me mad when people are working out this time of year just for prom & then they stop.. Like it should be something u do all year long
@VINNYBEEDLE  @jcarey07 @JV_TheKid @acampora10 @DannySomers33 yo dam bro thot we wer rostin mad chix free b4 10 pic.twitter.com/Mhv1sbhoy5
"mad respect when we all yelled ""Joey klett"" though. name another school that would do that  #joeyjuicyklett"
West Hartford center is so cute to the point where it makes me mad I don't live near it 
ANY BITTER ASS CHEERLEADER THAT IS MAD CAUSE WE BEAT THEM AT STATES CAN TALK SHIT TO ME
"I hate going to sleep mad, it's the same thing every night"
"cnt w8 4 ths yrs senior prank.. we shud lyk all sit on tha staircase so tha teachrs cn b lykk ...""hey.. get tha frik 2 class""tahuh mad serok"
I know females mad me an Shima together but idgaffff lol. @FlyGurlShima
- Im just being honest & your mad because ? Explain ? 
When a 22 year old gets mad at you for shitting on BVB >
People who always go home from college make me mad...gain some independence please
Lil Georgie just mad his jawn (@h_grabowski ) like me better
I'm mad I just found out @joeyBADASS_ @DirtySanchez47 are in new haven tonight.
My mom woke me up saying 'every great guy should wake up to something sweet on a day like today' and gave me a huge smooch and mad chocolate
Just listened to my boy @Mad_Menace_FF on shuffle my whole hour drive up to the Q #greatrap #flannelfrat
"I'm not mad at you, I'm mad at myself for wasting my time with you!"
IM SOOO MAD ........... pic.twitter.com/BHibyGz4u3
- hellooooo there your eyess>>>>> and you're mad cool
I'm single so don't be mad if guys try getting with me. If your mad? then cuff my ass other than that stfu.
People really got mad at the Doritos commercial where the foreigners sang the national anthem in diff languages? Ignorance at its finest
you go dad rock on you could say I'm not mad or anything pic.twitter.com/b7FqnCreP2
I'm tryin to have mad people come out this weekend...... Banger Saturday hmu
"Don't get mad when you see I've moved on boy, you crazy if you think you comin back' "
You can't stay mad at a person that makes you smile
Honestly anyone who gives those super sweet 16 kids shit about getting nice cars is just jealous & mad cuz they got broke parents
"When @TaylorNyari is mad about something, I ultimately get mad too. that's what friends are for"
I am the happiest person in the world in the summer like winter just makes me so mad
"Imagine how mad Bryan would get right now if Big Jim says, ""hey Bry how come come the mouse on this thing isn't working"""
He remind me of my little brother when he gets mad omg 
I'm the worst person to argue with  i just be making people mad asf with the shit i be saying lmao
Anybody else mad bored?
Girls on IG posting hella thirst taps but wanna get mad when they get a dick pic in they inbox smh
I love Richard Sherman lol he's mad funny and he talks mad shit
A lot of people gained mad weight after high school  
"You can tell me ADTR sucks, I won't be mad I promise"
"Well that's a crazy way to start my day. Now can I just watch movies, eat mad food and go into hibernation? "
I get so mad at the littlest things.
"No girl can make me mad over a boy I already had. How are you ""winning"" with old news. It's like you're walking in my old shoes"
"If I get mad at you, That means I still care. Worry when I don't get mad."
If your not mad then why tweet saying your not mad?
"Hot 93.7 tell em why you mad: ""I'm mad because my nephew is sleeping with my ex husband!"" "
Getting started @maxburgetct - Drinking a Mad King's Weiss by @VictoryBeer at @maxburgerct  — http://untp.it/1h3wDXw 
Mad beef on twitter. Can we just focus on today is a day dedicated for veterans and service members and thank them.
YO MAD PLUR TOMORROW HYFR pic.twitter.com/OCJIObDdh4
"if you love a sport so much then love it, don't get mad if someone else doesn't because obviously not everyone is gonna like the same thing"
"I love talking sports with people from Boston, we hate the same teams and have mad respect for each other's cities."
"""Is Tristen driving or something because he's taking mad long"""
Ppl be talking mad shit about Yung lean but still be repping sad boys
The juniors were mad wack for real I feel bad for them..
welp. just saw my first countdown to 25 days of Christmas commercial. can't say I'm mad about it
I had a dream I was being chased by mountain lion and a deer who got mad after I was taking pictures of them
As soon as the period goes at the end of my sentence I'm mad? Maybe I just want to be grammatically correct you little fucker.
Ugh people make me mad
I've had closure by the story so far stuck in my head all day. Not even mad about it though.
"Let me find out you at his place!!!! SOMEBODY GETTEN THE D*** TODAY!!!!“@angelashardae: it's mad cold in here , glen needa get it together.”"
You call yourself a music fan but you'll trash everything that isn't by your favorite artist? You're just mad other people think it's good.
"I'm mad the used ""Started From the bottom"" for a theme song for assassins creed new game "
"My two #1 lady's is mad at me..! Mom, esh. "
"Why would a tall bitch leav her crib in some tims then get mad when I dap her up.. u wanna look like a nigga, then get treated like a nigga"
"If your girl is mad at you sit down and talk to her, ya be on some gay shit trynna have a attitude just like a bitch."
"Hey this is Hot 93.7. Bristol Eastern, tell em why you mad?"
Girls aren't bipolar were just mad you don't read our minds and do everything we want 100% of the time
If you ever need a really good laugh just text Marco about things that'll get him mad and wait for his responses
#PerksOfDatingMe you could fuck the based god I won't even get mad
Good girls be mad bc hoes getting wifed but honestly hoes are just easier
Just made friends with a black kid from NYC . Said I was a 'mad funny cracka' #imintheclub
Soccer players are mad cute
I hear muffled music but I cannot figure out where it's coming from and it's making me so mad
A Day in the Life of Gucci Messiah? “@lesbolife: my mom is getting so mad at this documentary”
mom wasnt even mad about the ticket
"RFT “@RjayySantos: You can be mad at me, but im not losing sleep tonight.”"
Following me on twitter then being mad at my tweets is listening to Lil B music and then talking about how much you hate him
"When females get mad at you and never tell you why but ""I'm mad at you"" if I had a quarter for each time I heard that in life"
If you wanna be a model you have to get naked in front of mad ppl js
"You know Lisa's mad at you when the last thing she says to me when she leaves is ""shove it up your fucking ass"""
"""Fake"" boxed Julian last night. I was serious he wasn't, I punched him in the nose and he bled. Now he's mad at me...sorry @julianfocareta "
lol he's getting his girlfriend tampons at 8:30 at night. mad respect.
Tweet thru the hurt fam “@_Slowlyblowme: to sad to mad to tweet .”
Who chills outside at a party and makes mad noise?? Who cares if u need a bogey?! Is it worth getting the party busted?
My weakness is that I can't stay mad at people I like for anything
Live ass party in wtb hit me or @Fly_Guy_Philson up mad heads
Aaron Hernandez bout to have mad bitches in jail
“@Sunnydeazy: @MikeShannonn @Plugs_And_Drugs @toddo_16 @Captain_Kellogg nah fuck that Cameron got Mad jobs lets rob his white ass” I'm down
Paula Dean's like a natural kind of racist like I ain't even mad
TELL ME WHAT THEY MAD FO!!!!!!
@nickydonmtv it's mad hot
all of my little brothers track teammates know me as badbetchmiller... thts not okay
mad respect to my fellow seniors #family
#WhitePeopleActivities excepting my black ass in them home even tho they mad a f they daughter ain't choose a white boy
Nothing grosses me out more than a dude that talks to mad girls YUCK
Since everyone keeps asking and being noisy And hating on my God damn life. Yes me & @Madison_Tnt talk. Mad? Get the hell over it.
They got mad stereo typical ass old black niggas playing trombones & shit .. Wtf is this
"hey guys I don't know @alexacuted, but she got pretty mad when I pointed out how average looking John Mayer is. I legit lol'd at that reply."
Going to bed mad or upset is the fucking worst
"I think I went to misquamicut over 20 times last summer, def going mad times again this summer"
Ya females ain't low thou ! Telling mad niggas you will be they valentine so you could rack up on gifts ... Lmao no sir not ME
S/O to all you Task Force haters I know you mad cause my TL is straight BASED right now
"""Yeah I'm mad and I'm gonna ice you out, it'll be colder than north of The Wall..."" Game of Thrones fans, you understand"
Can't remember the last time I went to sleep sad or mad. Thank you @BooLovinqDino for always keeping my smile on my face. 
Mad as fuck I'm up right now.
I hate when you're single no girls want to talk to you but as soon as you get into a relationship MAD girls want to talk to you smh
Just unfollowed mad people on instagram
"@alexisstermini @cuteboiii101 @gb_ohgod @wwb10993 lol I'm sayin, mad fun though!"
@_SheLovesDree we was mad deep at the jerry springer show today shout out to my brother sleighdro.....I just felt like sayin dat
I'm just ready to swag out tonight and take mad pics 
"@JellyOrtiz_ @joeymaldonado_ that's mad cute , wish ya the best & for Christmas Im'a get my girlfriend the cool grey 9's & the kill Roy's 9s"
I don't wanna hear about Newtown anymore. It just gets me mad and down
Anyone mad right now?
“@bookiebby51: - dont be mad when im happy with someone else .”
"We may argue, fight, cry, get mad at each other, but nothing will break us apart <3 @ovoxo_bp"
I have mad respect for the people that are up right now and going to work fuck the ones bitching about waking up at 10 #onaregrind
#ICantStandWhen I'm sleeping in my room and people come in and out mad loud
"I don't even get mad anymore, because I expect certain things from certain people."
Who's mad?
Never go to bed mad.
"Mac & Webby the whole way home, and I ain't mad about it"
I'm not even mad at you I'm more so disappointed in the fact that you said you'd always be there for me but you're not.
Bae get mad wen i call other ppl my girlfriend lol its cute tho
I forgot today was double period lab!... I'm mad af
In#7thGrade mr smith slammed the door for being mad at mike sgambato and the clock fell on his head
Damn!! My husband @iismichelle is lookin mad fine in her twitter avi. #BATMAN2012 #myhusbandishotterthanyou #killyourself
"Damnn, It Aint Even Been A Full 24 Hours & Donald Trump ALREADY Talking Shit About #Obama ..Nigga You Mad?"
Wow I wasted like so much time on you. That's the only thing I'm mad about.
"3 lies from guys: I'm sorry, I love you, I won't hurt you .... 3 lies from girls: I'm fine, I'm not mad at you, I don't love you."
You're just mad because I learned to play your game. #andidoitbetter
When people try to get me mad. I just smile in there face #kanye
the fact that she don't even kno I'm mad at her makes me even more mad
"""Even when you're mad, think before u talk, the words u say can only be forgiven not forgotten"""
"""@Ms_Khalifax3: #Tbt I used to be mad fly lmao http://instagr.am/p/QYm2c5nwze/ "" nigga iremember when you used to be skinny like me :')"
Love how the weekend I plan too Sleep in. But I wake upp mad early! -____-
Yo it's mad funny trynna watch @chinx_dourx3 do push-ups and sit-ups
@iMartyM i don't know what your mad at but just blow it up
"Dude, chill! Mad cops! @devswagalicious"
"A real boyfriend knows his girl like the back of his hand . He knows when she's mad , sad , hurt&' angery .because thats his girl.!"
Bitches mad. Get over him. Fo real!!!
He's just mad he never got a slice of this cake 
Drake mad as hell haha
One way you can get me mad is by hanging up on my face! <<
Yaa bitch chose nigga don't be mad.
Mad I couldn't watch the game
Wtf -__- fuck westfarms they cuffed me up and shit then said it was a mistake cause of my common ass hilfiger shirt -____- Im really mad af
I'm not even mad that school is coming up.
I'm happy. You're not. That's why you mad doe!
@_dollfacesx3 Rs. Let Her Talk She Obviously Mad.  Your Cute Af. Let Her Lame Ass Rock.
I'm so mad!!!! No! William your #1 for me! Your an amazing man and dancer. I'm  so proud of you. Besos  @willylevy29 @DWTSWillyLevy
She's a fighter when she's mad and she's a lover when she's lovin'
When I first got a job I was mad hype.  Now I'm like wtf I gotta go to work -__-
"U can Get mad,it's life but U can also take responsibilities 4 ur actions#ManUp"
I hate when i text someone nd they dont text baxk nd i say something dumb nd they wanna get mad #owell
"@HeyImMEGA  @_8lovemeforme HELL YEA i hate dat shit to, dat shit RELLY get me mad af"
Ughh so mad at myself 
"; i ain't that mad, i just don't like bein lied to. #stan."
; 'are you mad at me?' no i'm actually happy that you broke my heart and hurt me.
I should call 93.7 && tell em why I'm mad . Theyd get a ear full .
Someone's mad 
I am really mad that I have no more tourments for wrestling /:  what am I going to do with my Saturday's ? #mangerproblems
Ya mad cus cole missed one layup ? While niggas is throwing air balls ? Foh
Just saw a dead horse and humped a tree at sleeping giant infront of mad people ..
I hate fat bilaungaul bitches mad nasty & smell like cheese
Don't You Hate It When You Can't Stay Mad At Someone ??
"Yes, that's @justinbieber at the Miami Heat game wearing a @pghpenguins snapback. Not even mad. pic.twitter.com/zdyNBume"
"I get jealous, I get mad, I get worried, I get curious. But that's only because I love you so much and I don't wanna lose you."
#iDislikeItWhen people get mad at me for no reason.
HOT 93.7 TELL EM WHY YOU MAD?!
"Kind of mad I can't go watch the basketball game tonight, goodluck boys! #BEVBB"
"If you're gonna dress like a skank, act like a skank and talk like a skank...then don't be mad when I call you a skank, skank."
So mad right now...
When I'm mad and people try to calm me down it makes me 10x madder.
#UseATwitterNameInASentence These girls are mad cause they know I'm @MostDope203
"When people are mad, they send one word texts. I do too, but instead of ""yea"" and ""k"" , I send ""KILL"" and ""PUNISH"""
Maybe you just mad cause I am who you wanna be.
Patriots making me mad smh
"Kinda Mad , I Would Be Usually Watching Basketball Right Now ! We Need a Nba Season !!!!!!!"
Breaking Bad is the best show on TV. Period. I'm sorry Mad Men. You got nothing compared to this. #BreakingBad
"Can't stand boys who text so cute, then are mad shy in person. #haveapersonality"
#YouShouldBeEmbarrassed if u get mad at someone that doesn't follow u
My lips are mad huge.
hot 93.7 tell em why u mad.
#WaysToPissMeOff Disrespect Me &' Get Mad When I Say Something Back
"I took ha to da Vet..cuz she a bad bitch, u can't be broke nd happy...so me I'm mad rich!! ;)"
One thing I miss about you is that even if we were mad at each other we still said I love you when we hung up the phone. #highschooldays
Wow. U mad bro? Lettuce be cereal for one minute.
